Title,Text,Section
"Anurag Kashyap had medical emergency after being gifted bag of marijuana by fan, says misconception of him being a ‘ganjedi’ hard to shake off","Director Anurag Kashyap said that the one misconception about himself that he’d want to change is that he enjoys partaking in marijuana. In an interview recently, the filmmaker said that he is actually allergic to the substance, and recalled a story about having to take an emergency antihistamine when a fan gifted him a box full of joints at a film festival.

Appearing on the Flip the Script with Shubra podcast, Anurag said, “Because I’ve made Gangs of Wasseypur and Raman Raghav, people think I’m a psychopath. People are initially very scared of meeting me. And when they meet me, they get totally overwhelmed because I’m completely opposite of their perception. I can’t change that. A lot of people think that I smoke up. Often, when I get trolled, people call me ‘ganjedi’ and ‘nashedi’. But I just roll my cigarettes; they don’t even know I’m allergic to it. I get serious asthma attacks even if I smell somebody smoking pot around me.”

Click for more updates and latest Bollywood news along with Entertainment updates. Also get latest news and top headlines from India and around the world at The Indian Express.",Bollywood
Bhumi Pednekar shares photo from hospital as she gets treatment for dengue: ‘Mujhe 8 din ka massive torture de diya’,"Actor Bhumi Pednekar has been admitted to Mumbai’s Hinduja Hospital for dengue treatment. Taking to Instagram on Wednesday, Bhumi updated her fans about her condition and shared that though she feels good now, the disease took a toll on her.

The actor shared selfies from her hospital bed and wrote, “Ek Dengue ke machar ne, mujhe 8 din ka massive torture de diya. But today I woke up feeling like a WOW, so I had to click a selfie.” Bhumi asked her Instagram family to be careful of mosquitos and keep their immunity high. She wrote, “Guys be careful, cause the last few days were extremely tough for my family and I. Mosquito repellent’s are a must right now. Keep your immunity up. High pollution levels have most of our immunities compromised. Quite a few people I know have gotten dengue recently. Yet again ek invisible virus ne halat kharab kar di :).”

Click for more updates and latest Bollywood news along with Entertainment updates. Also get latest news and top headlines from India and around the world at The Indian Express.",Bollywood
Sam Bahadur song Banda: ‘Unstoppable’ Vicky Kaushal is all action and no talk in latest number. Watch,"Sam Bahadur song Banda: ‘Unstoppable’ Vicky Kaushal is all action and no talk in latest number. Watch

Sam Bahadur song Banda: ‘Unstoppable’ Vicky Kaushal is all action and no talk in latest number. Watch

A week after the release of the first song, titled “Badhte Chalo“, the makers of Meghna Gulzar’s Vicky Kaushal-starrer Sam Bahadur have unveiled another powerful track, “Banda”, which is like an ode to the “unstoppable” Field marshal Sam Manekshaw.

The 126-second music video opens with scenes of Manekshaw (Vicky Kaushal) undergoing rigorous training in his early days. As the song unfolds, glimpses from various phases of his life are depicted, showcasing his charisma and unwavering determination. The lyrics, meanwhile, highlight his silent yet resolute approach: “[He] doesn’t listen, nor does he talk; he simply continues to do [what needs to be done].”

Click for more updates and latest Bollywood news along with Entertainment updates. Also get latest news and top headlines from India and around the world at The Indian Express.",Bollywood
"Shah Rukh Khan is IMDb’s biggest Indian star of 2023 as Bollywood makes comeback with Alia Bhatt, Deepika Padukone outranking Nayanthara","The Internet Movie Database (IMDb) on Wednesday announced its list of the most popular Indian stars of 2023, with Shah Rukh Khan taking the number one spot. The Badshaah of Bollywood has had a remarkable year, with two back-to-back blockbusters that broke numerous box office records. He first starred in Pathaan, and then in Jawan, which made a combined total of Rs 2200 crore globally. His third film of the year, Dunki, is lined up for release in December.

IMDb’s top 10 list also included two of his Jawan co-stars: Vijay Sethupathi took the number 10 spot, while Nayanthara claimed the fifth position. Sethupathi had a busy 2023, appearing in the streaming series Farzi and five other films, including the critically acclaimed Viduthalai Part 1. Nayanthara’s year, on the other hand, was dominated by Jawan.

Click for more updates and latest Bollywood news along with Entertainment updates. Also get latest news and top headlines from India and around the world at The Indian Express.",Bollywood
