Title,Text,Section
Pakistan names Wahab Riaz as head of national selection committee; Sohail Tanvir to head junior selection panel,"The overhaul in Pakistan cricketï¿½ï¿½ï¿½s top echelons continues after the teamï¿½ï¿½ï¿½s ouster from the ongoing Cricket World Cup after a fifth-place finish in the group stage.
Just two days after former Test captain Mohammad Hafeez was entrusted the role of Team Director for the Pakistan menï¿½ï¿½ï¿½s cricket team and Shan Masood and Shaheen Shah Afridi took over the reins of the national team from Babar Azam, the Pakistan Cricket Board picked two former Pakistan pacers to lead two crucial selection committees.
While former left-arm fast bowler Wahab Riaz was appointed as the chief selector of the national menï¿½ï¿½ï¿½s selection committee, Sohail Tanvir was named as the head of the junior selection committee.
Advertisement
Riazï¿½ï¿½ï¿½s first assignment will be the selection of the national menï¿½ï¿½ï¿½s squad for the three-match Test series against Australia from December 14 to January 7 in Australia and the five-match T20I series against New Zealand from January 12 to 21 in New Zealand. Riaz picked upross the three formats after making his debut for Pakistan in 2008. He represented Pakistan in 27 Tests, 91 ODIs and 36 T20Is.
A PCB press release making the announcement quoted Riaz ï¿½ï¿½ï¿½ who is Pakistanï¿½ï¿½ï¿½s second-most successful bowler in World Cups, registering 35 wickets across three editions of the marquee event ï¿½ï¿½ï¿½ as saying: ï¿½ï¿½ï¿½Heading a selection committee is a challenging task. We have a significant Australia tour coming up that is part of the ICC World Test Championship 2023-25 cycle and a T20I series against New Zealand that will allow us to develop a formidable unit leading up to the ICC T20 World Cup in the USA and West Indies in June next year.
ï¿½ï¿½ï¿½I have a good rapport with the Pakistan Menï¿½ï¿½ï¿½s Team Director Mohammad Hafeez and we will be working closely for the success of Pakistan cricket. My primary goal would be to give weightage to the top performers in domestic cricket and announce well-rounded squads equipped with the necessary skillsets. I will always beck and advice.ï¿½ï¿½ï¿½
Meanwhile, Tanvirï¿½ï¿½ï¿½s first assignment as chairperson of the junior selection committee will be the selection of the Pakistan U19 squad for the 2023 ACC U19 Asia Cup scheduled to be held between 8 and 17 December in UAE. Pakistan U19 will later take part in the ICC U19 World Cup from 13 January to 4 February in Sri Lanka.
Advertisement
Tanvir made his international debut in 2007 and made two Test, 62 ODI and 57 T20I appearances for Pakistan. He picked up 130 wickets and scored 612 runs across the th",Sports
"ýýýPressureýýý from parents behind student suicides, says Supreme Court","ýýýIntense competitionýýý and ýýýpressureýýý of parents on their wards preparing for competitive exams are the main reasons for the rising number of suicides across the country, the Supreme Court said on Monday.
Hearing a plea that sought regulation of the mushrooming coaching institutes and cited the data on student suicides, a bench of justices Sanjiv Khanna and SVN Bhatti, however, expressed helplessness and said the judiciary cannot pass directions in such a scenario.
ýýýThese are not easy things. Pressure from parents is behind all these incidents. More than the children, it is the parents who are putting pressure on them. How can the court pass directions in such a scenario,ýýý the bench told advocate Mohini Priya, appearing for the petitioner ýýý Mumbai-based doctor Aniruddha Narayan Malpani.
Advertisement
Justice Khanna said, ýýýAlthough, most of us will not want any coaching institute to be there, but look at the conditions of schools. There is intense competition and students have no other option but to go to these coaching institutes.ï¿½ï¿½ï¿½ Referring to the 2020 data of the National Crime Records Bureau (NCRB), Priya said it highlights that around 8.2 per cent of students in the country die by suicide.
The bench said that it knows about the situation but the court canï¿½ï¿½ï¿½t pass directions and suggested that the petitioner instead approach the government with his suggestions.
Priya sought to withdraw the plea to approach the appropriate forum, which the court allowed.
The plea filed by Malpani through Priya said that it seeks appropriate directions for regulating the conduct of ï¿½ï¿½ï¿½profit-hungry private coaching institutes mushrooming across India which provide coaching for various competitive entrance examinations such as IIT-JEE (Indian Institute of Technology Joint Entrance Examination) and NEET (National Eligibility cum Entrance Test)ï¿½ï¿½ï¿½.
Advertisement
It said that the petitioner has been constrained to approach the court as several students have died by suicide in recent years bulute lack of regulation and oversight by the Respondents (Centre and state governments)ï¿½ï¿½ï¿½.
ï¿½ï¿½ï¿½Children as young as 14 years enter these coaching factories often away from their homes and undergo rigorous preparation in the anticipation of getting admission to a good medical or engineering college.
ï¿½ï¿½ï¿½After being in a protected home environment, the child is suddenly exposed to the harsh competitive world without being mentally equipped to do so. These profit-hungry coaching institutes, however, do not care about student well-being and are only focussed on minting money leading to the youth of India being pressurised enough to take their own lives,ï¿½ï¿½ï¿½ the petition said.
Advertisement
It said that children are being made to live and study in these coaching factories in subpar and abnormal conditions which are severely affecting their mental health.
ï¿½ï¿½ï¿½What is most dangerous about mental health is that it is invisible, unlike other ailments in our body. However, just like other phyproblems too are triggered by extrinsic forces, surrounding environment and pressures,ï¿½ï¿½ï¿½ it said.
The plea said that student suicides were a grave human rights concern.
ï¿½ï¿½ï¿½The lackadaisical attitude of the Centre in enacting a law despite the rising number of suicides clearly reflects upon the Stateï¿½ï¿½ï¿½s apathy towards protecting these young minds who are the future of our country and their constitutional right to live with dignity guaranteed under Article 21,ï¿½",Education
ýýýSometimes itýýýs nice to see ball dominate batýýý: Mitchell Starc after Australia beat South Africa at Eden Gardens,"Mitchell Starc and Josh Hazlewood were the wreckers in chief for Australia after the Kangaroos bowled excellently in overcast conditions and reduced South Africa to 24/4 after Protea captain Bavuma won the toss and elected to bat.
However, David Millerï¿½ï¿½ï¿½s rescue act took the South Africans to a respectable score of 212 but it was not enough as Pat Cummins made sure his team didnï¿½ï¿½ï¿½t let the opportunity slip away in a low-scoring run-chase against South Africa in the semifinals on Thursday.
The captain had to bail out his team with the bat as he and Mitchell Starc got the Aussies home by three wickets in pursuit of a 213-run target.
Advertisement
After the match, the Aussie seamer spoke at length about the low-scoring thriller and the pitch at Eden Gardens.
ï¿½ï¿½ï¿½ I think it was a tricky wicket throughout and I guess different phases of pressure for both teams throughout the game. So, yeah, I was pretty calm. I think Pat was pretty calm as well. And whilst it was pretty close, we had plenty of squeeze past and make to a final,ï¿½ï¿½ï¿½ Starc said while speaking at the post-match press conference.
However, Starc was a bit surprised at the nature of the surface and said, ï¿½ï¿½ï¿½Yeah, Iï¿½ï¿½ï¿½m certainly not going to say Iï¿½ï¿½ï¿½m one to read pitches and know what they do. I mean, training here the last few days, the practice wicket certainly turned a lot. From all reports, I think the wicket we played on has been used a few times so no surprise that it did turn. It is probably a little surprising that it did seam around a little bit whilst I said before it was pretty inconsistent pace wise, I think average first inning scores here have been sort of around 300 mark or a little bit higher. So yeah, a little bit surprising but you know sometimes itï¿½ï¿½ï¿½s nice to see ball dominate bat.ï¿½ï¿½ï¿½
On a personal front with the ball, Starc, who picked 3/34, expressed happiness with his spell and said, ï¿½ï¿½ï¿½Yeah, thatï¿½ï¿½ï¿½s probably not been the tournament I would have liked from the get go br power play was probably what got us on our way. And there were other key moments through the day with bat and ball, but to start the game like that with Joshie [Hazelwood] and I, power play wickets have probably been not our strong suit through the tournament so itï¿½ï¿½ï¿½s nice to have a power play of what two for 18 or something like that so the way Josh bowled throughout to finish two for 12 was incredible, and then Trav with bat and ball. I think a lot of guys in the field as well, the way Davey stepped up in the field and led by example. You could probably name everyone at different circumstances through the day to really step up in a big ga",Sports
Sourav Gangulyï¿½ï¿½ï¿½s tribute to Virender Sehwag: ï¿½ï¿½ï¿½You changed dynamics of batting at top,"Former India captain Sourav Ganguly has showered praise on Virender Sehwag, who has been included in the ICC Hall of Fame.

ï¿½ï¿½ï¿½You changed the dynamics of batting at the top in Test cricket. Your talent was special. You scored runs at such a fast pace, you were just exceptionally good, and you are probably the best opening batsman after Sunil Gavaskar,ï¿½ï¿½ï¿½ Ganguly wrote in his letter to Sehwag.

Ganguly recalls how he first heard about Sehwag and what was his specialty that made him different from the others.

Advertisement

ï¿½ï¿½ï¿½I remember there was a lot of talk when you first played first-class cricket around how good you were, how hard you hit the ball and how you cleared the boundary ropes.

Follow all the action from the Cricket World Cup 2023 on our special World Cup section. You can also find the latest stats, like the top scorer and the highest wicket-taker of the current edition, upcoming World Cup fixtures and the points table on the site.

ï¿½ï¿½ï¿½That is how I first heard of you.  updating us that you were very good, and you came into the international set-up early on,ï¿½ï¿½ï¿½ said Ganguly.

The former India captain also revealed why the Delhi batsman was bit tentative when he asked him to open for the first time in a Test match at Lordï¿½ï¿½ï¿½s in 2002.

Advertisement

ï¿½ï¿½ï¿½I remember when I told you that you should try opening, you were unsure because you had never done it,ï¿½ï¿½ï¿½ said Ganguly.

ï¿½ï¿½ï¿½I believe no-one is born to bat in any particular position and that you could do it because of the talent you possessed.

ï¿½ï¿½ï¿½You were initially tentative but once you got going for the first time in a Test match at Lordï¿½ï¿½ï¿½s in 2002, you got an 80 in no time. From there, your confidence continued to grow.ï¿½ï¿½ï¿½

Advertisement

Ganguly admitted Sehwag was a better Test batter and explained: ï¿½ï¿½ï¿½You enjoyed playing all the different formats and while you were good at one-day cricket, I think you were even better in Tests.

ï¿½ï¿½ï¿½You could do it in all confavourite innings. You hit a six to get to 200 and then did the same to get to 300 ï¿½ï¿½ï¿½ and you had told us you were going to do it too!

ï¿½ï¿½ï¿½Having you opening the batting made life easy for the batters that came a",Sports
"South Africa vs Afghanistan Highlights, World Cup 2023: Rassie van der Dussen anchors chase to help SA win by 5 wickets","South Africa vs Afghanistan Live Score: Rashid Khan speaks

""Definitely. That game was hard to take for us. It was heart breaking. We dominated but credit to Maxwell for taking the game away from us. The conversation was to focus on the positives and take those things into the game against South Africa. We have to focus on the positives. Played a lot earlier in IPL. Good batting wicket and there is help for the bowlers. We should think about our skills and adjust to the conditions soon as possible. We need to do that whether in Chennai, Delhi, Lucknow and Pune. You can only share the records. You have to adjust and see how it goes. Lots of positive for us. 3-4 guys scoring runs and scoring big 100s. The batting department has set up and the top 5 is contributing for us and taking it deep. The ideal thing has been them finishing the game quite well. Positive things from the World Cup we have got. Those two points were massive for us. Thank you so much.""",Sports
Suryakumar Yadav likely to captain India in T20Is against Australia,"SURYAKUMAR Yadav is likely to lead the Indian team in the five-match T20I series against Australia with Hardik Pandya ruled out because of an injury he sustained during the World Cup. The series will begin on November 23 in Vizag and finish at Hyderabad on December 3.
The BCCIï¿½ï¿½ï¿½s senior national selection committee is set to meet soon to pick the squad and given the series is coming close on the heels of the World Cup, a second-string team will be picked.
World no 1 batsman in T20 format, Yadav was appointed as the vice-captain of the T20 side during Indiaï¿½ï¿½ï¿½s tour of West Indies, where they played five matches in the Caribbean and US. With Pandya yet to recover from the ankle injury he suffered during the World Cup and a doubtful starter, the selecting committee headed by Ajit Agarkar is likely to elevate Yadav to the captaincy.
Advertisement
Follow all the action from the Cricket World Cup 2023 on our special World Cup section. You can also find the latest stats, like the top scorer and the higtaker of the current edition, upcoming World Cup fixtures and the points table on the site.
The 33-year-old Yadav has earlier led the Mumbai team and also India Under-23 team in the Emerging Cup a few years ago. His 360 style of play has gained him immense popularity and in a short time, Yadav has become the most lethal batsman in the world in the format.
The Indian Express understands that the selection committee will give rest to the majority of players who are part of the ongoing World Cup team. Players like Ishan Kishen and Prasidh Krishna, who didnï¿½ï¿½ï¿½t get much of the World Cup game will be asked to play home series against Australia.
With Rahul Dravidï¿½ï¿½ï¿½s contract coming to an end after the World Cup, the BCCI have asked VVS Laxman to coach the Indian team for a stop gap arrangement and the support staff of National Cricket Academy (NCA) will be asked to look after the team.
Advertisement
Reason for Yadavï¿½ï¿½ï¿½s appointment is after the selection committee came to know that Pandya will tanths to recover fully from his ankle injury.
He is likely to miss three T20I and three ODIï¿½ï¿½ï¿½s games against South Africa too.
Itï¿½ï¿½ï¿½s not clear whether Pandya needs sur",Sports
"Tamil Nadu TNDGE Class 10th, 12th half-yearly exam dates released","The Tamil Nadu Directorate of Government Examinations (TN DGE) has announced the Class 6 to Class 12 half-yearly exam dates for the 2024 session. The Tamil Nadu Class 11 and Class 12 half-yearly exams will begin on December 7, 2023 and will continue till December 22 and the TNDGE Class 6 to Class 10 half yearly exams will be held between December 11 and 21.
The Directorate will conduct the Class 11 exams from 9:45 am to 12:45 pm and Class 12 exams between 1:30 to 4:30 pm. The students will be given 10 minutes of reading time before the start of the exams.",Education
